show_id,type,title,director,cast,country,date_added,release_year,rating,duration,listed_in,description
s69,Movie,14 Blades,Daniel Lee,"Donnie Yen, Zhao Wei, Wu Chun, Law Kar-Ying, Kate Tsui, Yuwu Qi, Wu Ma, Chen Kuan Tai, Sammo Kam-Bo Hung, Chen Zhi Hui, Damian Lau, Xiang Dong Xu","Hong Kong, China, Singapore",3-Apr-19,2010,R,113 min,"Action & Adventure, International Movies","In the age of the Ming Dynasty, Quinglong is the best of the Jinyiwei, an elite assassin squad made up of highly trained former street urchins. When evil eunuch Jia unseats the emperor, Quinglong is called to action but is quickly betrayed."
s70,Movie,14 Cameras,"Scott Hussion, Seth Fuller","Neville Archambault, Amber Midthunder, Brytnee Ratledge, Hank Rogerson, Chelsea Edmundson, John-Paul Howard, Lora Martinez-Cunningham, Brianne Moncrief",United States,27-Oct-18,2018,TV-MA,89 min,"Horror Movies, Thrillers","Upping the “13 Cameras” ante, this sequel finds a family renting a vacation house that’s been customized to violate their privacy."
s71,Movie,14 Minutes from Earth,"Adam Davis, Jerry Kolber, Trey Nelson, Erich Sturm",,United States,1-Feb-19,2016,TV-MA,84 min,Documentaries,A Google executive boldly attempts a death-defying mission to travel to space and free-fall back to Earth without a rocket.
s72,Movie,16 Blocks,Richard Donner,"Bruce Willis, Mos Def, David Morse, Jenna Stern, Cylk Cozart, Casey Sander, David Zayas, Robert Racki, Patrick Garrow, Sasha Roiz","United States, Germany",1-Nov-19,2006,PG-13,102 min,Action & Adventure,"Tasked with escorting a prosecution witness to court, an aging cop gears up for the 16-block trek – but they'll be lucky to make it there alive."
s73,Movie,17 Again,Burr Steers,"Zac Efron, Leslie Mann, Matthew Perry, Thomas Lennon, Michelle Trachtenberg, Melora Hardin, Sterling Knight, Hunter Parrish, Nicole Sullivan, Allison Miller",United States,1-Jan-21,2009,PG-13,102 min,Comedies,"Nearing a midlife crisis, thirty-something Mike wishes for a ""do-over"" – and that's exactly what he gets when he wakes up to find he's 17 again."
s74,Movie,18 Presents,Francesco Amato,"Vittoria Puccini, Benedetta Porcaroli, Edoardo Leo, Sara Lazzaro, Marco Messeri, Betty Pedrazzi, Alessandro Giallocosta, Filippo Gili, Giacomo Rosselli",Italy,8-May-20,2020,TV-MA,114 min,"Dramas, Independent Movies, International Movies",A pregnant mother with terminal cancer leaves behind 18 sentimental gifts for her unborn daughter to receive every birthday until she reaches womanhood.
s75,Movie,1898: Our Last Men in the Philippines,Salvador Calvo,"Luis Tosar, Javier Gutiérrez, Álvaro Cervantes, Karra Elejalde, Carlos Hipólito, Ricardo Gómez, Patrick Criado, Eduard Fernández, Miguel Herrán, Emilio Palacios",Spain,2-Jun-17,2016,R,130 min,"Dramas, International Movies","While Spain relinquishes its last colonies, a battle-fatigued outpost engages in a long, brutal and sometimes bizarre clash with Filipino insurgents."
s76,Movie,1BR,David Marmor,"Nicole Brydon Bloom, Giles Matthey, Taylor Nichols, Alan Blumenfeld, Celeste Sully, Susan Davis, Clayton Hoff, Earnestine Phillips",United States,23-Aug-20,2019,TV-MA,90 min,"Horror Movies, Independent Movies, Thrillers","Seeking her independence, a young woman moves to Los Angeles and settles into a cozy apartment complex with a disturbing sense of community."
s77,Movie,1st Summoning,Raymond Wood,"Hayley Lovitt, Teddy Cole, Brook Todd, Ace Harney, Jason Macdonald",United States,26-Jul-19,2018,TV-MA,94 min,"Horror Movies, Independent Movies","Student filmmakers uncover occult rituals tied to an abandoned warehouse, then gradually realize the horror is closer than they think."
s78,Movie,2 Alone in Paris,"Ramzy Bedia, Éric Judor","Ramzy Bedia, Éric Judor, Benoît Magimel, Kristin Scott Thomas, Élodie Bouchez, Édouard Baer, Fred Testot, Omar Sy",France,1-Jun-20,2008,TV-MA,97 min,"Comedies, International Movies","A bumbling Paris policeman is doggedly determined to capture the master thief that repeatedly eludes him, even when they're the last two men on Earth."
s79,Movie,2 States,Abhishek Varman,"Alia Bhatt, Arjun Kapoor, Ronit Roy, Amrita Singh, Revathy, Aru Krishansh Verma",India,4-Aug-18,2014,TV-PG,143 min,"Comedies, Dramas, International Movies","Graduate students Krish and Ananya hope to win their parents' approval before they marry, but the two families clash over their cultural differences."
s80,Movie,20 Feet From Stardom,Morgan Neville,"Darlene Love, Merry Clayton, Lisa Fischer, Táta Vega, Claudia Lennear, Judith Hill, Bruce Springsteen, Mick Jagger, Stevie Wonder, Sting, Bette Midler, Cissy Houston, Sheryl Crow, Tata Vega",United States,22-Sep-18,2013,PG-13,91 min,"Documentaries, Music & Musicals","Winner of the 2014 Academy Award for Best Documentary Feature, this film takes a look at the world of backup vocalists and the legends they support."
s81,TV Show,20 Minutes,,"Tuba Büyüküstün, Ilker Aksum, Bülent Emin Yarar, İpek Bilgin, Müjde Uzman, Firat Çelik, Ayten Uncuoglu, Cihat Tamer",Turkey,15-Aug-17,2013,TV-MA,1 Season,"Crime TV Shows, International TV Shows, TV Dramas","When his wife is convicted of murder, a horrified family man races to prove her innocence while a dogged investigator sets out to uncover the truth."
s82,Movie,2015 Dream Concert,,"4Minute, B1A4, BtoB, ELSIE, EXID, EXO, Got7, INFINITE, KARA, Shinee, Sistar, VIXX, Nine Muses, BTS, Secret, Topp Dogg",South Korea,28-Apr-17,2015,TV-PG,107 min,"International Movies, Music & Musicals","The world's biggest K-pop festival marked its 21st year in 2015, with groups such as EXO, 4Minute and SHINee electrifying the Seoul World Cup Stadium."
s83,Movie,2036 Origin Unknown,Hasraf Dulull,"Katee Sackhoff, Ray Fearon, Julie Cox, Steven Cree, David Tse, Joe David Walters",United Kingdom,20-Dec-18,2018,TV-14,95 min,Sci-Fi & Fantasy,"Working with an artificial intelligence to investigate the failure of a deadly Mars landing, a mission controller makes an astonishing discovery."
s84,Movie,20th Century Women,Mike Mills,"Annette Bening, Elle Fanning, Greta Gerwig, Lucas Jade Zumann, Billy Crudup",United States,28-Jun-19,2016,R,119 min,"Dramas, Independent Movies","In 1979, single bohemian mom Dorothea, hoping to help her teen son find his place as a man, asks two young women to share their lives with him."
s85,Movie,21 & Over,"Jon Lucas, Scott Moore","Miles Teller, Skylar Astin, Justin Chon, Sarah Wright, Jonathan Keltz, François Chau, Russell Hodgkinson, Daniel Booko, Russell Mercado, Josie Loren, Dustin Ybarra",United States,16-Apr-19,2013,R,93 min,Comedies,Jeff's straight-and-narrow life changes abruptly when his buddies take him out for a birthday bash – the night before a crucial med school interview.
s86,TV Show,21 Again,,Laura Morgan,United Kingdom,1-Jul-20,2019,TV-MA,1 Season,"British TV Shows, Reality TV","In a social experiment, a group of daughters sends their mothers, disguised as 21-year-olds, into the world to experience life as a member of Gen Z."
s87,TV Show,21 Sarfarosh: Saragarhi 1897,,"Luke Kenny, Mohit Raina, Mukul Dev",India,1-Dec-18,2018,TV-14,1 Season,"International TV Shows, TV Dramas","In one of history's greatest last stands, a battalion of 21 Sikh soldiers fights to defend their outpost from attack by over 10,000 Afghans."
s88,TV Show,21 Thunder,,"Stephanie Bennett, Emmanuel Kabongo, RJ Fetherstonhaugh, Andres Joseph, Kevin Claydon, Conrad Pla, Clark Backo, Ryan Pierce, Eileen Li, Susan Bain, Cristina Rosato, Jonathan Kim, Colm Feore",Canada,1-Mar-18,2017,TV-MA,1 Season,"Crime TV Shows, International TV Shows, TV Dramas","Players and coaches for a Montreal soccer team chase dreams of stardom while their personal lives erupt with love, fear, passion and violence."
s89,Movie,2307: Winter's Dream,Joey Curtis,"Paul Sidhu, Arielle Holmes, Branden Coles, Kelcey Watson, Anne-Solenne Hatte, Brad Potts, Timothy Lee DePriest, Fernando Argosino, Duchess Dukes, Harwood Gordon, Stormi Henley",United States,1-Mar-18,2016,TV-MA,101 min,"Action & Adventure, Independent Movies, Sci-Fi & Fantasy","In the frozen tundra of a futuristic Arizona where humans have been forced underground, a soldier hunts the bioengineered leader of a rebellion."
s90,Movie,24 Hours to Live,Brian Smrz,"Ethan Hawke, Xu Qing, Paul Anderson, Rutger Hauer, Tyrone Keogh, Nathalie Boltt, Liam Cunningham","South Africa, China, United States",7-Apr-18,2017,R,93 min,Action & Adventure,"Revived by an experimental procedure, a hit man gets to live an extra 24 hours – which he uses to avenge his dead wife and child and redeem himself."
s91,Movie,25 Kille,Simranjit Singh Hundal,"Guggu Gill, Yograj Singh, Sonia Mann, Jimmy Sharma, Sapna Bassi, Lakha Lakhwinder Singh, Sandeep Kaur Sandy, Sardar Sohi",India,1-Oct-18,2016,TV-14,140 min,"Action & Adventure, Dramas, International Movies","Four brothers learn that they have inherited ancestral land, but must fight to claim it when a greedy feudal lord threatens to take it over."
s92,Movie,26 Years,Geun-hyun Cho,"Goo Jin, Hye-jin Han, Soo-bin Bae, Seul-ong Im, Kyeong-yeong Lee, Gwang Jang, Deok-jae Jo, Eui-sung Kim, Seok-Hwan An, Bok-gi Min",South Korea,1-Oct-17,2012,TV-MA,135 min,"Dramas, International Movies, Thrillers","Twenty-six years after the 1980 massacre at Gwangju, South Korea, three relatives of the victims come together to avenge the infamous orchestrator."
s93,Movie,"27, el club de los malditos",Nicanor Loreti,"Diego Capusotto, Sofía Gala, Daniel Aráoz, Willy Toledo, El Polaco, Paula Manzone, Yayo Guridi, Guillermo Toledo",Argentina,1-May-18,2018,TV-MA,82 min,"Action & Adventure, Comedies, International Movies","After a musician dies under suspicious circumstances, a hard-drinking detective and a music fan investigate why rock stars often die at the age of 27."
s94,Movie,27: Gone Too Soon,Simon Napier-Bell,"Janis Joplin, Jimi Hendrix, Amy Winehouse, Jim Morrison, Kurt Cobain",United Kingdom,1-May-18,2017,TV-MA,70 min,Documentaries,"Explore the circumstances surrounding the tragic deaths at 27 of Jimi Hendrix, Jim Morrison, Brian Jones, Janis Joplin, Kurt Cobain and Amy Winehouse."
s95,Movie,28 Days,Betty Thomas,"Sandra Bullock, Viggo Mortensen, Dominic West, Diane Ladd, Elizabeth Perkins, Steve Buscemi, Alan Tudyk, Mike O'Malley, Azura Skye, Reni Santoni, Marianne Jean-Baptiste",United States,30-Sep-20,2000,PG-13,104 min,"Comedies, Dramas","After her drunken antics result in property damage, an alcoholic journalist enters rehab – and soon meets a fellow resident who changes her outlook."
s96,TV Show,28 Moons,,"Jin-sung Yang, Kyu-jong Kim, Tae-hwan Kang, Geummi",South Korea,10-Jun-17,2016,TV-PG,1 Season,"International TV Shows, Korean TV Shows, Romantic TV Shows","When her fiancé acts strangely upon receiving a mysterious invitation, a florist sets out to find out the truth behind the tiny scrap of paper."
s97,Movie,3 Days to Kill,McG,"Kevin Costner, Amber Heard, Hailee Steinfeld, Connie Nielsen, Tómas Lemarquis, Richard Sammel, Marc Andréoni, Bruno Ricci, Jonas Bloquet, Eriq Ebouaney","United States, France, Serbia",1-Dec-20,2014,PG-13,117 min,Action & Adventure,A terminally ill secret agent accepts a risky mission in exchange for an experimental drug that might save him – if he can survive its side effects.
s98,Movie,3 Deewarein,Nagesh Kukunoor,"Naseeruddin Shah, Jackie Shroff, Juhi Chawla, Nagesh Kukunoor, Gulshan Grover, Aditya Lakhia, Shri Vallabh Vyas",,31-Dec-19,2003,TV-MA,121 min,"Dramas, International Movies, Thrillers","A reporter interviews three convicts on death row for a documentary but as their stories emerge, so do her own true motivations for soliciting them."
s99,Movie,3 Generations,Gaby Dellal,"Elle Fanning, Naomi Watts, Susan Sarandon, Tate Donovan, Linda Emond, Jordan Carlos, Sam Trammell, Maria Dizzia, Tessa Albertson",United States,28-Aug-17,2015,PG-13,92 min,"Dramas, LGBTQ Movies","When teenage Ray begins transitioning from female to male, his single mom and grandmother must cope with the change while tracking down his father."
s100,Movie,3 Heroines,Iman Brotoseno,"Reza Rahadian, Bunga Citra Lestari, Tara Basro, Chelsea Islan",Indonesia,5-Jan-19,2016,TV-PG,124 min,"Dramas, International Movies, Sports Movies",Three Indonesian women break records by becoming the first of their nation to medal in archery at the Seoul Olympics in the summer of 1988.
s101,Movie,3 Idiots,Rajkumar Hirani,"Aamir Khan, Kareena Kapoor, Madhavan, Sharman Joshi, Omi Vaidya, Boman Irani, Mona Singh, Javed Jaffrey",India,1-Aug-19,2009,PG-13,164 min,"Comedies, Dramas, International Movies","While attending one of India's premier colleges, three miserable engineering students and best friends struggle to beat the school's draconian system."
s102,Movie,3 Seconds Divorce,Shazia Javed,,Canada,15-Jun-19,2018,TV-PG,53 min,"Documentaries, Faith & Spirituality","A Muslim women's activist group in India protests against oral divorces, starting a movement to reclaim their religious and constitutional rights."
s103,Movie,3 Türken & ein Baby,Sinan Akkuş,"Kostja Ullmann, Eko Fresh, Kida Khodr Ramadan, Sabrina Klüber, Sami Nasser, Kayla Rybicka, Jytte-Merle Böhrnsen, Emrah Erdogru, Tim Grothe, Hülya Duyar",Germany,15-Dec-16,2015,TV-MA,93 min,"Comedies, International Movies",The lives of three dissatisfied brothers running a family bridal shop turn topsy-turvy when one of them has to care for his ex-girlfriend's baby.
s104,Movie,30 Days of Luxury,Hani Hamdi,"Taher Farouz, Sad Al-Saghir, Ahmad Faloks, Soleiman Eid, Mahmood El-Laithi, Hesham Ismail, Shaima Saif, Nermin Maher, Sofinar",Egypt,18-Apr-19,2016,TV-14,91 min,"Comedies, International Movies","With the help of his friends, a man breaks out of prison in hopes of restoring a lively nightclub."
s105,Movie,30 Minutes or Less,Ruben Fleischer,"Jesse Eisenberg, Danny McBride, Aziz Ansari, Nick Swardson, Dilshad Vadsaria, Michael Peña, Bianca Kajlich, Fred Ward",United States,1-Jan-21,2011,R,83 min,"Action & Adventure, Comedies",Two crooks planning a bank heist wind up abducting a pizza delivery driver and force him to commit the robbery — with a strict time limit.
s106,Movie,300 Miles to Heaven,Maciej Dejczer,"Krzysztof Stroiński, Andrzej Mellin, Adrianna Biedrzyńska, Adrianna Biedrzyńska, Rafał Zimowski, Kama Kowalewska, Wiesław Komasa, Aleksander Bednarz, Jadwiga Jankowska-Cieslak, Wojciech Klata","Denmark, France, Poland",1-Oct-19,1989,TV-14,93 min,"Dramas, International Movies","Hoping to help their dissident parents, two brothers sneak out of Poland and land as refugees in Denmark, where they are prevented from returning home."
s107,Movie,365 Days,"Barbara Białowąs, Tomasz Mandes","Anna-Maria Sieklucka, Michele Morrone, Bronisław Wrocławski, Otar Saralidze, Magdalena Lamparska, Natasza Urbańska, Grażyna Szapołowska, Tomasz Stockinger, Gianni Parisi, Mateusz Łasowski",Poland,7-Jun-20,2020,TV-MA,114 min,"Dramas, International Movies, Romantic Movies","A fiery executive in a spiritless relationship falls victim to a dominant mafia boss, who imprisons her and gives her one year to fall in love with him."
s108,Movie,37 Seconds,Hikari,"Mei Kayama, Misuzu Kanno, Shunsuke Daitoh, Makiko Watanabe, Yoshihiko Kumashino, Minori Hagiwara, Shohei Uno, Yuka Itaya, Kiyohiko Shibukawa, Eita Okuno, Haruka Imou, Toshinori Omi",Japan,31-Jan-20,2020,TV-MA,116 min,"Dramas, International Movies","Trapped by society and familial obligations, a young manga artist goes on an unconventional journey for sexual freedom and personal liberation."
s109,TV Show,3Below: Tales of Arcadia,,"Tatiana Maslany, Diego Luna, Nick Offerman, Nick Frost, Glenn Close, Alon Aboutboul, Hayley Atwell, Darin De Paul, Andy Garcia, Cheryl Hines, Tom Kenny, Chris Obi, Cole Sand, Frank Welker, Steven Yeun",United States,12-Jul-19,2019,TV-Y7,2 Seasons,"Kids' TV, TV Action & Adventure, TV Sci-Fi & Fantasy","After crash-landing on Earth, two royal teen aliens on the run struggle to blend in with humans as they evade intergalactic bounty hunters."
s110,Movie,40 Sticks,Victor Gatonye,"Robert Agengo, Mwaura Bilal, Andreo Kamau, Cajetan Boy, Arabron Nyyeneque, Shiviske Shivisi, Xavier Ywaya",Kenya,20-Nov-20,2019,TV-14,93 min,"International Movies, Thrillers","When their prison bus crashes in a forest on a rainy night, a group of criminals finds themselves battling wild animals and a mysterious killer."
s111,Movie,42 Grams,Jack C. Newell,Jake Bickelhaupt,United States,1-Feb-18,2017,TV-MA,81 min,Documentaries,"After launching a successful underground restaurant out of their apartment, an ambitious chef and his wife open an all-consuming upscale eatery."
s112,TV Show,44 Cats,,"Sarah Natochenny, Suzy Myers, Simona Berman, Erica Schroeder, Marca Leigh, Scottie Ray, Henry F. Benjamin",Italy,1-Oct-20,2018,TV-Y7,2 Seasons,Kids' TV,"Paw-esome tales abound when singing furry friends Lampo, Milady, Pilou and Meatball band together."
s113,TV Show,45 rpm,,"Carlos Cuevas, Guiomar Puerta, Iván Marcos, Israel Elejalde, Eudald Font, Luis Larrodera, Carmen Gutiérrez, Diana Gómez, Vito Sanz, Marina San José, Pere Ponce, Joan Pera",Spain,16-Aug-19,2019,TV-MA,1 Season,"International TV Shows, Romantic TV Shows, Spanish-Language TV Shows","In 1960s Madrid, music producer Guillermo Rojas launches a rock 'n' roll label with the help of aspiring singer Robert and clever producer Maribel."
s114,Movie,48 Christmas Wishes,"Marco Deufemia, Justin G. Dyck","Khiyla Aynne, Noah Dyer, Maya Franzoi, Clara Kushnir, Madeline Leon, Liam MacDonald, Matt Schichter, Ethan Yang, Adam Crew",Canada,20-Dec-17,2017,TV-G,84 min,"Children & Family Movies, Comedies","When a small town's letters to Santa accidentally go up in smoke, two elves venture out of the North Pole to retrieve every missing wish."
s115,Movie,4L,Gerardo Olivares,"Jean Reno, Hovik Keuchkerian, Susana Abaitua, Juan Dos Santos, Arturo Valls, Enrique San Francisco, Francesc Garrido, Eric Nguyen",Spain,12-Jul-19,2019,TV-MA,105 min,"Comedies, Dramas, Independent Movies","Hoping to reunite with a dying friend, two longtime pals re-create their desert road trip from Spain to Mali, bringing along his estranged daughter."
s116,Movie,4th Man Out,Andrew Nackman,"Evan Todd, Parker Young, Chord Overstreet, Jon Gabrus, Kate Flannery, Brooke Dillman, Jennifer Damiano, Jordan Lane Price, Alex Rennie, Jake Epstein",United States,5-May-16,2015,NR,86 min,"Comedies, LGBTQ Movies","A young mechanic comes out to his extremely straight best friends. Once they get used to the idea, they're determined to help him find the right guy."
s117,Movie,4th Republic,Ishaya Bako,"Kate Henshaw-Nuttal, Enyinna Nwigwe, Linda Ejiofor, Yakubu Mohammed, Bimbo Manuel, Sani Mu’azu, Emil Hirai-Garuba, Rekiya Ibrahim Atta",Nigeria,13-Jun-20,2019,TV-MA,120 min,"Dramas, International Movies, Thrillers","After the election-night murder of her campaign manager at a polling site, a gubernatorial candidate challenges the corrupt incumbent's victory."
s118,Movie,5 Cowok Jagoan,Anggy Umbara,"Ario Bayu, Arifin Putra, Dwi Sasono, Muhadkly Acho, Cornelio Sunny, Tika Bravani, Nirina Zubir, Ganindra Bimo, Verdi Solaiman",,5-Jan-19,2017,TV-MA,106 min,"Action & Adventure, Comedies, International Movies",Yanto asks his friends to help save a girlfriend who was kidnapped by a mobster. Silly slapstick and campy crimefighting ensues.
s119,Movie,5 Flights Up,Richard Loncraine,"Josh Pais, Claire van der Boom, Morgan Freeman, Diane Keaton, Carrie Preston, Cynthia Nixon, Korey Jackson, Diane Ciesla, Michael Cristofer",United States,17-Mar-19,2014,PG-13,92 min,"Comedies, Dramas, Independent Movies","A couple finds unexpected drama when, after 40 years of living in the same Brooklyn walk-up, they attempt to sell their apartment and buy a new one."
s120,Movie,5 Star Christmas,Marco Risi,"Massimo Ghini, Ricky Memphis, Martina Stella, Ralph Palka, Biagio Izzo, Riccardo Rossi, Paola Minaccioni",Italy,7-Dec-18,2018,TV-14,96 min,"Comedies, International Movies","When the Italian prime minister meets his lover and political rival while on an official trip to Budapest during Christmas week, things go topsy-turvy."
s121,Movie,5 to 7,Victor Levin,"Anton Yelchin, Bérénice Marlohe, Olivia Thirlby, Lambert Wilson, Frank Langella, Glenn Close",United States,16-Mar-17,2014,R,97 min,"Comedies, Dramas, Romantic Movies",A young novelist's life is turned upside down when a chance encounter outside a New York hotel leads to an intense affair with a diplomat's wife.
s122,Movie,50 First Dates,Peter Segal,"Adam Sandler, Drew Barrymore, Rob Schneider, Sean Astin, Lusia Strus, Dan Aykroyd, Amy Hill, Allen Covert, Blake Clark, Maya Rudolph",United States,1-Dec-20,2004,PG-13,99 min,"Comedies, Romantic Movies","After falling for a pretty art teacher who has no short-term memory, a marine veterinarian has to win her over again every single day."
s123,Movie,50/50,Jonathan Levine,"Joseph Gordon-Levitt, Seth Rogen, Anna Kendrick, Bryce Dallas Howard, Anjelica Huston, Serge Houde, Andrew Airlie, Matt Frewer, Philip Baker Hall, Marie Avgeropoulos, Jessica Parker Kennedy",United States,1-Jun-19,2011,R,100 min,"Comedies, Dramas, Independent Movies",An otherwise healthy twentysomething has a comically early midlife crisis when he gets slapped with a cancer diagnosis and a 50-50 chance of survival.
s124,Movie,5CM,Rizal Mantovani,"Herjunot Ali, Raline Shah, Fedi Nuril, Pevita Pearce, Saykoji, Denny Sumargo, Didi Petet, Firrina Sinatrya",Indonesia,28-Sep-18,2012,TV-14,126 min,"Dramas, International Movies","Five friends embark on a mission to climb the highest peak in Java, overcoming obstacles on the way and discovering the true meaning of friendship."
s125,Movie,5Gang,Matei Dima,"Andrei Selaru, Dorian Popa, Julia Marcan, Ana Radu, Cosmin Nedelcu, Diana Condurache, Andrei Gavril, Luca Bogdan",Romania,27-Apr-20,2019,TV-14,96 min,"Comedies, International Movies","To keep the band together, Selly tries to earn money by making an appearance at the birthday party of a mobster's daughter — until he gets kidnapped."
s126,Movie,6 Balloons,Marja Lewis Ryan,"Abbi Jacobson, Dave Franco, Jane Kaczmarek, Tim Matheson, Charlotte Carel, Madeline Carel, Maya Erskine, Dawan Owens, Jen Tullock",United States,6-Apr-18,2018,TV-MA,75 min,"Dramas, Independent Movies",A loyal sister struggles to stay afloat while driving her heroin-addicted brother to a detox center and looking after his 2-year-old daughter.
s127,Movie,6 Days,Toa Fraser,"Jamie Bell, Abbie Cornish, Mark Strong, Martin Shaw, Ben Turner, Aymen Hamdouchi, Tim Pigott-Smith, Robert Portal, Colin Garlick, Andrew Grainger, Martin Hancock, Emun Elliott","New Zealand, United Kingdom",8-Feb-18,2017,R,94 min,"Action & Adventure, Dramas, International Movies","When armed gunmen seize the Iranian Embassy in 1980, a tense six-day standoff ensues while elite British soldiers prepare for a dangerous raid."
s128,Movie,6 Underground,Michael Bay,"Ryan Reynolds, Mélanie Laurent, Corey Hawkins, Dave Franco, Adria Arjona, Manuel Garcia-Rulfo, Ben Hardy, Lior Raz, Payman Maadi, Yuri Kolokolnikov, Kim Kold",United States,13-Dec-19,2019,R,129 min,"Action & Adventure, Dramas","After faking his death, a tech billionaire recruits a team of international operatives for a bold and bloody mission to take down a brutal dictator."
s129,Movie,6 Years,Hannah Fidell,"Taissa Farmiga, Ben Rosenfield, Lindsay Burdge, Joshua Leonard, Jennifer Lafleur, Peter Vack, Dana Wheeler-Nicholson, Jason Newman, Molly McMichael",United States,8-Sep-15,2015,TV-MA,80 min,"Dramas, Independent Movies, Romantic Movies","As a volatile young couple who have been together for six years approach college graduation, unexpected career opportunities threaten their future."
s130,Movie,6-5=2,Bharat Jain,"Prashantt Guptha, Gaurav Paswala, Gaurav Kothari, Disha Kapoor, Niharica Raizada, Ashrut Jain, Darshan Machamada",India,1-Nov-17,2014,TV-MA,103 min,"Horror Movies, International Movies, Thrillers","Six friends decide to undertake a grueling mountain trek, only to find that the difficulties in store for them are not merely physical."
s131,TV Show,60 Days In,,,United States,1-Nov-20,2019,TV-MA,1 Season,Reality TV,"Recruited by a sheriff, volunteers infiltrate county prisons to expose corruption and crime from within the system in this docuseries."
s132,Movie,68 Kill,Trent Haaga,"Matthew Gray Gubler, AnnaLynne McCord, Alisha Boe, Sheila Vand, Sam Eidson, James Moses Black, Ajay Mehta, Michael Beasley, David Maldonado, Hallie Grace Bradley, Peter Jaymes Jr., Eric Podnar, Lucy Faust",United States,1-Sep-19,2017,R,96 min,"Comedies, Independent Movies, Thrillers",A hapless guy agrees to help his stunning – but psychotic – girlfriend rob her loathsome sugar daddy in a scheme as ill-conceived as it is violent.
s133,TV Show,7 (Seven),Nizar Shafi,"Rahman, Havish, Regina Cassandra, Nandita Swetha, Anisha Ambrose, Tridha Choudhury, Pujitha Ponnada, Aditi Arya",India,30-Jul-19,2019,TV-14,1 Season,TV Shows,"Multiple women report their husbands as missing but when it appears they are looking for the same man, a police officer traces their cryptic connection."
s134,Movie,7 años,Roger Gual,"Paco León, Juana Acosta, Juan Pablo Raba, Alex Brendemühl, Manuel Morón",Spain,27-Oct-16,2016,TV-MA,77 min,"Dramas, International Movies",Loyalties are tested and cruelties revealed when four business partners spend a tense evening debating who will pay for the crime they committed.
s135,TV Show,7 Days Out,,,United States,21-Dec-18,2018,TV-PG,1 Season,Docuseries,"Witness the excitement and drama behind the scenes in the seven days leading up to major live events in the worlds of sports, fashion, space and food."
