show_id,type,title,director,cast,country,date_added,release_year,rating,duration,listed_in,description
s268,Movie,Aakhri Adaalat,Rajiv Mehra,"Vinod Khanna, Dimple Kapadia, Jackie Shroff, Sonam, Vinod Mehra, Shafi Inamdar, Gulshan Grover, Roopesh Kumar",India,1-Sep-17,1988,TV-14,148 min,"Action & Adventure, International Movies",An intrepid police inspector forced into a desk job must take matters into his own hands when ruthless criminals are released on a technicality.
s269,Movie,Aalorukkam,V C Abhilash,"Indrans, Sreekanth Menon, Vishnu Agasthya, Aliyar, Seethabaala, Shaji John, Sajith Nampiyar, Benny Vadakkan",India,15-Nov-18,2018,TV-PG,122 min,"Dramas, Independent Movies, International Movies","When an aging father seeks the help of a doctor and a journalist to look for the son who left him 16 years ago, he learns some surprising truths."
s270,Movie,Aamir,Raj Kumar Gupta,"Rajeev Khandelwal, Gajraj Rao, Shashanka Ghosh, Jhilmil Hazrika, Gazala Amin, Allauddin Khan",India,1-Nov-18,2008,TV-14,95 min,"International Movies, Thrillers","In this high-tension thriller, an anonymous caller on a cell phone threatens to harm a man's family if he doesn't carry out every order."
s271,Movie,Aapla Manus,Satish Rajwade,"Nana Patekar, Sumeet Raghvan, Iravati Harshe, Aashish Kulkarni, Savita Malpekar",India,10-Sep-20,2018,TV-14,133 min,"Dramas, International Movies, Thrillers","When a man falls from his balcony, an investigator questions the victim’s family, determined to uncover a darker truth behind the alleged accident."
s272,Movie,Aarakshan,Prakash Jha,"Amitabh Bachchan, Saif Ali Khan, Manoj Bajpayee, Deepika Padukone, Prateik, Tanvi Azmi, Saurabh Shukla, Darshan Jariwala, Yashpal Sharma, Mukesh Tiwari",India,31-Dec-19,2011,TV-14,164 min,"Dramas, International Movies",The decision by India's supreme court to establish caste-based reservations for jobs in education causes conflict between a teacher and his mentor.
s273,Movie,Aashayein,Nagesh Kukunoor,"John Abraham, Sonal Sehgal, Prateeksha Lonkar, Girish Karnad, Farida Jalal, Ashwin Chitale, Anaitha Nair, Vikram Inamdar, Vipin Bhali, Poonam Chitale, Nagesh Kukunoor",India,22-Oct-17,2010,TV-14,115 min,"Dramas, International Movies","When he learns he has terminal cancer, a cynical gambler and chronic smoker ditches his fiancée, snubs doctors and checks into a nursing home to die."
s274,Movie,Aashik Awara,Umesh Mehra,"Saif Ali Khan, Mamta Kulkarni, Mohnish Bahl, Sharmila Tagore, Saeed Jaffrey, Kader Khan",India,1-Jun-17,1993,TV-14,154 min,"Dramas, International Movies, Music & Musicals","Raised by a kindly thief, orphaned Jimmy goes on the run from goons and falls in love with Jyoti, whose father indirectly caused his parents' deaths."
s275,Movie,Aata Pita,Uttung Shelar,"Sanjay Narvekar, Bharat Jadhav, Satish Phulekar, Ashwini Apte",India,1-Jan-18,2010,TV-14,133 min,"Comedies, Dramas, International Movies",A municipal clerk with literary ambitions stalks a loan recovery officer on whom he has decided to base his story's central character.
s276,Movie,Aaviri,Ravi Babu,"Ravi Babu, Neha Chauhan, Sri Muktha, Bharani Shankar, Mukhtar Khan, Priya",India,31-Dec-19,2019,TV-14,110 min,"Horror Movies, International Movies, Thrillers","After losing their first child in an accident, a couple moves to a palatial home, where their young daughter comes under the spell of an eerie spirit."
s277,TV Show,Abby Hatcher,Kyran Kelly,"Macy Drouin, Wyatt White, Paul Sun-Hyung Lee, Michela Luci, Christian Dal Dosso, Laaibah Alvi, Leo Orgil","United States, Canada",1-Jul-20,2019,TV-Y,1 Season,Kids' TV,"A big-hearted girl helps her Fuzzly friends who live in her family's hotel with exploring feelings, fixing mishaps and embracing their special quirks."
s278,Movie,Abby Sen,Atanu Ghosh,"Abir Chatterjee, Raima Sen, Arunima Ghosh, Priyanka Sarkar, Sujan Mukherjee, Kanchan Mullick, Biswanath Basu, Bhaswar Chatterjee, Swagata Basu, Tuhin Mitra, Paran Banerjee, Kharaj Mukherjee, Chiranjit",India,1-May-17,2015,TV-PG,127 min,"Comedies, Dramas, International Movies","After losing his seventh job in a row, a TV producer and sci-fi buff travels back in time to 1980, where his employment prospects improve."
s279,Movie,ABCD 2,Remo D'Souza,"Prabhu Deva, Varun Dhawan, Shraddha Kapoor, Lauren Gottlieb, Sushant Pujari, Punit Pathak, Dharmesh Yelande, Raghav Juyal",India,1-Nov-18,2015,TV-14,146 min,"Dramas, International Movies, Music & Musicals","After being accused of cheating on a reality TV show, a dance troupe seeks to redeem itself by winning the World Hip-Hop Dance Championship."
s280,Movie,ABCD: Any Body Can Dance,Remo D'Souza,"Prabhu Deva, Kay Kay Menon, Ganesh Acharya, Dharmesh Yelande, Salman, Lauren Gottlieb, Noorin Sha, Punit Pathak",India,1-Nov-18,2013,TV-14,136 min,"Dramas, International Movies","Thrown out of the elite dance studio he founded, Vishnu's spirits rebound when he sees young street dancers prepping for an annual contest."
s281,Movie,Abdo Mota,,Mohamed Ramadan,Egypt,19-Apr-19,2012,TV-MA,100 min,"Action & Adventure, Dramas, International Movies","Following the mysterious death of his parents, a young man finds himself enmeshed in the dark world of drugs and crime."
s282,Movie,Abducted in Plain Sight,Skye Borgman,,United States,15-Jan-19,2017,TV-14,90 min,Documentaries,"In this true crime documentary, a family falls prey to the manipulative charms of a neighbor, who abducts their adolescent daughter. Twice."
s283,Movie,"Abdullah, The Final Witness",Hashim Nadeem Khan,"Sajid Hasan, Hameed Sheikh, Habibullah Panezai, Imraan Abbas, Sadia, Imran Tareen, Asal Deen, Yameen Shah",Pakistan,15-Jan-19,2016,TV-14,88 min,"Dramas, International Movies","Inspired by real events, this drama follows a trucker jailed after driving five ill-fated travelers across Quetta, and the officer taking on his case."
s284,Movie,Abhinetri,A. L. Vijay,"Tamannaah Bhatia, Prabhu Deva, Sonu Sood, Sapthagiri, Murli Sharma, R.V. Udhaykumar, Joy Mathew, Hema",India,1-May-18,2016,TV-14,131 min,"Comedies, International Movies, Sci-Fi & Fantasy","Due to family pressure, a corporate man reluctantly marries a woman from the village, but in their new home, she abruptly assumes a different persona."
s285,TV Show,Abnormal Summit,"Jung-ah Im, Seung-uk Jo","Hyun-moo Jun, Si-kyung Sung, Se-yoon Yoo",South Korea," August 4, 2017",2017,TV-PG,2 Seasons,"International TV Shows, Korean TV Shows, Stand-Up Comedy & Talk Shows","Led by a trio of Korean celebs, a multinational panel of men engage in – usually – lighthearted debates on issues that surround Korea and beyond."
s286,Movie,Abominable Christmas,Chad Van De Keere,"Isabella Acres, Drake Bell, Emilio Estevez, Nolan Gould, Matthew Lillard, Ray Liotta, Jane Lynch, Ariel Winter",United States,18-Feb-16,2012,TV-Y7,44 min,"Children & Family Movies, Comedies",Two small abominable snowmen flee their mountain to escape a scientist who's trying to capture them and end up spending Christmas with a human family.
s287,Movie,About a Boy,"Chris Weitz, Paul Weitz","Nicholas Hoult, Toni Collette, Victoria Smurfit, Sharon Small, Natalia Tena, Isabel Brook, Hugh Grant, Rachel Weisz, Nicholas Hutchison","United Kingdom, United States, France, Germany",1-Feb-19,2002,PG-13,101 min,"Comedies, Dramas, International Movies","Hip, irresponsible Londoner Will invents an imaginary son and starts attending single-parent meetings to find available women."
s288,Movie,About Time,Richard Curtis,"Domhnall Gleeson, Rachel McAdams, Bill Nighy, Lydia Wilson, Lindsay Duncan, Richard Cordery, Tom Hollander, Margot Robbie, Joshua McGuire, Vanessa Kirby",United Kingdom,16-Apr-19,2013,R,123 min,"Comedies, Dramas, International Movies","When Tim learns that the men in his family can travel in time and change their own lives, he decides to go back and win the woman of his dreams."
s289,TV Show,Abstract: The Art of Design,,"Christoph Niemann, Tinker Hatfield, Es Devlin, Bjarke Ingels, Paula Scher, Platon, Ilse Crawford, Ralph Gilles",United States,25-Sep-19,2019,TV-14,2 Seasons,Docuseries,Step inside the minds of the most innovative designers in a variety of disciplines and learn how design impacts every aspect of life.
s290,TV Show,Absurd Planet,,Afi Ekulona,United States,22-Apr-20,2020,TV-PG,1 Season,"Docuseries, Science & Nature TV, TV Comedies","A cast of quirky critters and Mother Nature herself narrate this funny science series, which peeks into the lives of Earth’s most incredible animals."
s291,TV Show,Abyss,,"Park Bo-young, Ahn Hyo-seop, Lee Sung-jae, Lee Si-eon, Han So-hee, Kwon Soo-hyun, Kim Sa-rang, Ahn Se-ha, Yun Yoo-sun",South Korea,7-May-19,2019,TV-14,1 Season,"Crime TV Shows, International TV Shows, Korean TV Shows","After meeting an untimely demise in separate incidents, Cha Min and Go Se-yeon discover they’ve come back to life in new bodies they don’t recognize."
s292,Movie,Abzurdah,Daniela Goggi,"Eugenia Suárez, Esteban Lamothe, Gloria Carrá, Rafael Spregelburd, Tomás Ottaviano, Julieta Gullo, Zoe Hochbaum, Lucia Carolina Pecrul",Argentina,25-Aug-16,2015,TV-MA,90 min,"Dramas, International Movies",A disenfranchised 16-year-old girl connects to an older man on the internet and after a brief one-sided affair descends into obsession and anorexia.
s293,Movie,Acapulco La vida va,Alfonso Serrano Maturino,"Patricio Castillo, Sergio Bustamante, Alejandro Suárez, Luz María Jerez, Bob Isaacs, Tere Monroy",Mexico,3-Jun-17,2016,TV-MA,89 min,"Comedies, Dramas, International Movies","Three lifelong friends travel to Acapulco ostensibly so one of them can find his lost love, but the real reason behind the trip holds some surprises."
s294,Movie,Accident,Cheang Pou Soi,"Louis Koo, Richie Ren, Stanley Fung Sui-Fan, Michelle Ye, Lam Suet, Alexander Chan, Monica Mok",Hong Kong,1-Dec-18,2009,TV-MA,87 min,"International Movies, Thrillers",A contract killer skilled at staging lethal accidents fears he may be a victim of his own strategy when an accomplice dies in a mysterious mishap.
s295,TV Show,Accidentally in Love,,"Junchen Guo, Yi Ning Sun, Yi Qin Zhao, Mu Xuan Cheng, Li Ma, Mo Zhou",China,19-Oct-18,2018,TV-14,1 Season,"International TV Shows, Romantic TV Shows, TV Comedies","Rejecting the demands of her wealthy family, a young woman poses as an ordinary college student and crosses paths with a stoic pop star at school."
s296,Movie,Across Grace Alley,Ralph Macchio,"Ben Hyland, Marsha Mason, Karina Smirnoff, Colin Branca, Ralph Macchio, Tricia Paoluccio",United States,1-Dec-16,2013,TV-PG,24 min,Dramas,"A young boy, upset by his parents' divorce, becomes infatuated with his grandmother's neighbor, an entrancing dancer he watches through a window."
s297,Movie,Across The Line,Julien Christian Lutz,"Sarah Jeffery, Simon Paul Mutuyimana, Denis Theriault, Jeremiah Sparks, Steven Love, Cara Ricketts, Jim Codrington, Shamier Anderson, Stephan James, Lanette Ware, Hugh Thompson",Canada,1-Apr-19,2015,TV-MA,88 min,"Dramas, Sports Movies","A black high school student sets his sights for the National Hockey League, but rising racial tensions in his community may jeopardize his goals."
s298,Movie,Across the Universe,Julie Taymor,"Evan Rachel Wood, Jim Sturgess, Joe Anderson, Dana Fuchs, Martin Luther, James Urbaniak, T.V. Carpio, Spencer Liff","United States, United Kingdom",1-Jan-19,2007,PG-13,133 min,"Dramas, Music & Musicals, Romantic Movies","An American girl and a British lad fall in love amid the social and political upheaval of the 1960s, in this musical featuring songs by the Beatles."
s299,Movie,Act of Valor,"Mike McCoy, Scott Waugh","Keo Woolford, Drea Castro, Emilio Rivera, Rorke Denver, Jason Cottle, Ailsa Marshall, Alex Veadov, Dave, Roselyn Sanchez, Thomas Rosales Jr., Nestor Serrano, Gonzalo Menendez",United States,1-Jun-20,2012,R,110 min,Action & Adventure,An elite squad of Navy SEALs is tasked with rescuing a kidnapped CIA agent from a lethal terrorist cell.
s300,Movie,Act of Vengeance,Mahsun Kırmızıgül,"Haluk Bilginer, Mahsun Kırmızıgül, Mustafa Sandal, Gina Gershon, Robert Patrick, Danny Glover, Engin Altan Düzyatan, Scott William Winters, Sharrieff Pugh","Turkey, United States",29-Sep-18,2010,NR,112 min,"Action & Adventure, International Movies","Two Turkish agents are sent to New York City on a mission to capture a notorious terrorist known only as ""Dejjal"" (Arabic for Antichrist)."
s301,Movie,Action Replayy,Vipul Amrutlal Shah,"Akshay Kumar, Aishwarya Rai Bachchan, Om Puri, Kiron Kher, Neha Dhupia, Rannvijay Singh, Aditya Roy Kapur, Sudeepa Singh, Randhir Kapoor, Rajpal Yadav",India,11-May-20,2010,TV-PG,129 min,"Children & Family Movies, Comedies, International Movies","Sick of his parents’ constant squabbling, a young man travels back in time to the onset of their romance, with plans to set them up for marital bliss."
s302,Movie,Acts of Vengeance,Isaac Florentine,"Antonio Banderas, Karl Urban, Paz Vega, Robert Forster, Clint Dyer, Cristina Serafini, Lillian Blankenship, Atanas Srebrev, Mark Rhino Smith","Bulgaria, United States",25-Jan-18,2017,R,87 min,"Action & Adventure, International Movies","Devastated by the murder of his wife and child, a formerly fast-talking lawyer takes a vow of silence and trains himself for a mission of revenge."
s303,Movie,Acts of Violence,Brett Donowho,"Cole Hauser, Bruce Willis, Shawn Ashmore, Ashton Holmes, Melissa Bolona, Patrick St. Esprit, Sophia Bush, Mike Epps",Canada,1-Aug-20,2018,R,87 min,Action & Adventure,"When his future sister-in-law is kidnapped by human traffickers, a military veteran joins forces with his brothers and a world-weary cop to rescue her."
s304,TV Show,Ad Vitam,,"Yvan Attal, Garance Marillier, Niels Schneider, Victor Assié, Rod Paradot, Anne Azoulay, Adel Bencherif",France,1-Nov-19,2018,TV-MA,1 Season,"Crime TV Shows, International TV Shows, TV Dramas","In a future where regeneration technology lets humans live indefinitely, a cop and a troubled young woman investigate a strange wave of youth suicides."
s305,Movie,Adú,Salvador Calvo,"Luis Tosar, Anna Castillo, Álvaro Cervantes, Miquel Fernández, Jesús Carroza, Moustapha Oumarou, Adam Nourou, Zayidiyya Dissou, Ana Wagener, Nora Navas",Spain,1-Jul-20,2020,TV-MA,120 min,"Dramas, International Movies","Near a Spanish town in northern Africa, a child takes a painful journey, a father reconnects with his daughter and a coast guard is guilt stricken."
s306,Movie,Adam Devine: Best Time of Our Lives,Jay Karas,Adam Devine,United States,18-Jun-19,2019,TV-MA,59 min,Stand-Up Comedy,"Frenetic comic Adam Devine talks teen awkwardness, celebrity encounters, his ""Pitch Perfect"" audition and more in a special from his hometown of Omaha."
s307,TV Show,Adam Ruins Everything,,"Adam Conover, Adam Lustick, Emily Axford",United States,30-Sep-18,2018,TV-14,1 Season,TV Comedies,"Education can be fun – and funny. Comedian Adam Conover bursts misconceptions, deconstructs topics and leaves with positive takeaways."
s308,Movie,ADAM SANDLER 100% FRESH,Steve Brill,Adam Sandler,United States,23-Oct-18,2018,TV-MA,74 min,Stand-Up Comedy,"From ""Heroes"" to ""Ice Cream Ladies"" – Adam Sandler's comedy special hits you with new songs and jokes in an unexpected, groundbreaking way."
s309,Movie,Adam: His Song Continues,Robert Markowitz,"Daniel J. Travanti, JoBeth Williams, Richard Masur, Martha Scott, Paul Regina",United States,1-Oct-11,1986,TV-MA,96 min,Dramas,"After their child was abducted and murdered, John and Reve Walsh fought to raise national awareness of the problem of missing children."
s310,Movie,Addicted to Life,Thierry Donard,"Antoine Bizet, Jesse Richman, Karsten Gefle, Wille Lindberg, Matahi Drollet, Mathias Wyss, Matt Annetts",France,12-Jun-20,2014,TV-14,91 min,"Action & Adventure, Documentaries, International Movies","Chasing extreme challenges, athletic daredevils test their limits in various environments from giant waves to snowy slopes around the world."
s311,Movie,Adel Karam: Live from Beirut,,Adel Karam,United States,1-Mar-18,2018,TV-MA,59 min,Stand-Up Comedy,"From Casino du Liban, Lebanese actor and comedian Adel Karam delivers earthy punchlines on kissing norms, colonoscopies and a porn star named Rocco."
s312,Movie,Adhugo,,,India,15-Jan-19,2018,TV-14,105 min,"Comedies, International Movies, Thrillers",A fast-footed piglet named Bunty becomes an object of desire for rival criminals that want the swift swine for their profitable animal-racing schemes.
s313,Movie,Aditi Mittal: Things They Wouldn't Let Me Say,Fazila Allana,Aditi Mittal,India,18-Jul-17,2017,TV-MA,63 min,Stand-Up Comedy,"Trailblazing comic Aditi Mittal mixes topical stand-up with frank talk about being single, wearing thongs and the awkwardness of Indian movie ratings."
s314,Movie,Adore,Anne Fontaine,"Naomi Watts, Robin Wright, Xavier Samuel, James Frecheville, Ben Mendelsohn, Jessica Tovey, Sophie Lowe, Gary Sweet, Alyson Standen, Skye Sutherland, Sarah Henderson","Australia, France",20-Nov-19,2013,R,111 min,"Dramas, Independent Movies, International Movies","When lifelong friends Roz and Lil fall in love with each other's teenage sons, they must carry out their affairs in relative secrecy."
s315,Movie,Adrift,Baltasar Kormákur,"Shailene Woodley, Sam Claflin, Jeffrey Thomas, Elizabeth Hawthorne","Hong Kong, Iceland, United States",1-Sep-20,2018,PG-13,96 min,"Action & Adventure, Dramas, Romantic Movies",A young couple’s sailing adventure becomes a fight to survive when their yacht faces a catastrophic hurricane in this story based on true events.
s316,Movie,Adrishya,Sandeep Chatterjee,"Ravi Kumar, Ayesha Singh, Nishat Mallick, Archana Kotwal, Rakesh Chaturvedi Om, Nidhi Mahavan, Abhijit Sinha, Abdur Rehman",India,31-Dec-19,2017,TV-14,99 min,"Horror Movies, Independent Movies, International Movies",A family’s harmonious existence is interrupted when the young son begins showing symptoms of anxiety that seem linked to disturbing events at home.
s317,Movie,Advantageous,Jennifer Phang,"Jacqueline Kim, James Urbaniak, Freya Adams, Ken Jeong, Jennifer Ehle, Samantha Kim, Troi Zee, Olivia Horton, Jennifer Ikeda, Mercedes Griffeth",United States,23-Jun-15,2015,TV-MA,92 min,"Dramas, Independent Movies, Sci-Fi & Fantasy","In order to keep her job at a biomedical engineering firm that prizes youth, a middle-aged woman must submit to a drastic experimental procedure."
s318,Movie,Adventures in Public School,Kyle Rideout,"Daniel Doheny, Judy Greer, Siobhan Williams, Russell Peters, Grace Park, Andrew McNee, Alex Barima, Andrew Herr, Eva Day, Josh Epstein","Canada, United States",15-Aug-18,2018,NR,86 min,Comedies,"After years of home-schooling, an awkward teen decides he wants a public high school experience, but his overbearing mother struggles to let go."
s319,Movie,Aerials,S.A. Zaidi,"Saga Alyasery, Ana Druzhynina, Mansour Al Felei, Mohammad Abu Diak, Pascale Matar, Luke Coutts, Abeer Mohammed",United Arab Emirates,7-May-20,2016,TV-14,90 min,"International Movies, Sci-Fi & Fantasy",Dubai residents struggle to figure out why a fleet of alien spaceships are hovering over their city when all contact with the outside world is cut off.
s320,TV Show,Afflicted,,,United States,10-Aug-18,2018,TV-MA,1 Season,"Docuseries, Reality TV, Science & Nature TV",Baffling symptoms. Controversial diagnoses. Costly treatments. Seven people with chronic illnesses search for answers – and relief.
s321,Movie,Afonso Padilha: Classless,"Junior Carelli, Rudge Campos",Afonso Padilha,Brazil,3-Sep-20,2020,TV-MA,63 min,Stand-Up Comedy,Brazilian comedian Afonso Padilha dives into his humble beginnings and digs out hilarious stories about his childhood in this very personal set.
s322,TV Show,Africa,,David Attenborough,United Kingdom,28-Apr-16,2013,TV-PG,1 Season,"British TV Shows, Docuseries, International TV Shows","This five-part nature series chronicles fascinating stories of survival on the African continent, home to the most diverse animal life on the planet."
s323,TV Show,Afronta! Facing It!,Juliana Vicente,"Loo Nascimento, Ingrid Silva, Rincon Sapiência, Batekoo, Gabriel Martins, Benjamin Abras, Daniele DaMata, Tasha & Tracie Okereke, Mariana de Matos, André Novais, Mahal Pita, Grace Passô, Thamyra Thâmara, Xenia França, Criola, Dani Ornellas, Anelis Assumpção, Magá Moura, Tássia Reis, Liniker, Yasmin Thayná, Raquel Virgínia, Juliana Luna, Erica Malunguinho, Diane Lima, Karol Conká",Brazil,31-Oct-20,2017,TV-PG,1 Season,"Docuseries, International TV Shows","This docuseries spotlights Afro-Brazilian thinkers sharing their individual journeys and discussing representation, entrepreneurship and community."
s324,Movie,After,Jenny Gage,"Josephine Langford, Hero Fiennes Tiffin, Selma Blair, Inanna Sarkis, Shane Paul McGhie, Pia Mia, Khadijha Red Thunder, Dylan Arnold, Samuel Larsen, Jennifer Beals, Peter Gallagher",United States,9-Oct-19,2019,PG-13,106 min,"Dramas, Romantic Movies","Wholesome college freshman Tessa Young thinks she knows what she wants out of life, until she crosses paths with complicated bad boy Hardin Scott."
s325,TV Show,After Life,,"Ricky Gervais, Tom Basden, Tony Way, Diane Morgan, Mandeep Dhillon, David Bradley, Ashley Jensen, Kerry Godliman",United Kingdom,24-Apr-20,2020,TV-MA,2 Seasons,"British TV Shows, International TV Shows, TV Comedies","Struggling to come to terms with his wife's death, a writer for a newspaper adopts a gruff new persona in an effort to push away those trying to help."
s326,Movie,After Maria,Nadia Hallgren,,United States,24-May-19,2019,TV-PG,38 min,Documentaries,"Displaced by Hurricane Maria, three Puerto Rican women navigate their families' uncertain futures as their federal housing aid in New York expires."
s327,Movie,After Porn Ends,Bryce Wagoner,,United States,27-May-19,2012,NR,93 min,Documentaries,"This documentary explores the careers of some of porn's top stars and examines their adjustment to ""normal"" society after leaving adult entertainment."
s328,Movie,After Porn Ends 3,Brittany Andrews,,United States,30-Dec-18,2018,TV-MA,87 min,Documentaries,This third installment in a documentary series examines the lives of the adult film genre's biggest stars after their industry careers have ended.
s329,Movie,After the Raid,Rodrigo Reyes,,"United States, Mexico",19-Dec-19,2019,TV-PG,25 min,"Documentaries, International Movies",A large immigration raid in a small town leaves emotional fallout and hard questions for its churchgoers about what it means to love thy neighbor.
s330,Movie,After We Collided,Roger Kumble,"Josephine Langford, Hero Fiennes Tiffin, Dylan Sprouse, Selma Blair, Louise Lombard, Shane Paul McGhie, Candice King, Charlie Weber, Khadijha Red Thunder, Inanna Sarkis, Pia Mia, Samuel Larsen, Dylan Arnold, Karimah Westbrook, Rob Estes",United States,22-Dec-20,2020,R,105 min,"Dramas, Romantic Movies","Tessa fell hard and fast for Hardin, but after a betrayal tears them apart, she must decide whether to move on — or trust him with a second chance."
s331,Movie,Aftermath,Elliott Lester,"Arnold Schwarzenegger, Scoot McNairy, Maggie Grace, Judah Nelson, Glenn Morshower, Hannah Ware, Mo McRae, Martin Donovan, Larry Sullivan, Mariana Klaveno, Kevin Zegers, Lewis Pullman","United Kingdom, United States",15-Mar-20,2017,R,94 min,Dramas,"After an air traffic controller's mistake results in a tragic accident, a man who lost his wife and daughter seeks answers from the man responsible."
s332,Movie,Afterschool,Antonio Campos,"Ezra Miller, Addison Timlin, Jeremy Allen White, Michael Stuhlbarg, Emory Cohen, David Costabile, Rosemarie DeWitt, Dariusz M. Uczkowski, Gary Wilmes, Paul Sparks, Alexandra Neil, Lee Wilkof",United States,13-Aug-20,2008,TV-MA,107 min,"Dramas, Independent Movies","When a prep school loner films two classmates overdosing on cocaine, his footage plays a role in the emotional fallout within the school community."
s333,Movie,Aftershock,Nicolás López,"Eli Roth, Andrea Osvárt, Ariel Levy, Natasha Yarovenko, Nicolás Martínez, Lorenza Izzo, Marcial Tagle, Ramón Llao, Ignacia Allamand, Paz Bascuñán","United States, Chile",7-Mar-18,2012,R,89 min,"Action & Adventure, Horror Movies","An American tourist and his friends are partying in Chile, but a major earthquake devastates the area and forces them to scramble for survival."
s334,TV Show,Against the Tide,,"Christopher Lee, Rui En, Desmond Tan, Zheng Geping, Zhang Zhenhuan, Paige Chua, Xu Bin, Carrie Wong",Singapore,1-Jul-17,2014,TV-14,1 Season,"Crime TV Shows, International TV Shows, TV Dramas",A detective and a psychologist investigating a string of murders form a crime-solving team with the novelist whose work inspired the killings.
s335,Movie,Agatha and the Truth of Murder,Terry Loane,"Ruth Bradley, Pippa Haywood, Dean Andrews, Bebe Cave, Blake Harrison, Tim McInnerny, Ralph Ineson, Michael McElhatton",United Kingdom,31-Jan-19,2018,TV-MA,92 min,Dramas,"In a dramatized depiction of her 11-day disappearance, novelist Agatha Christie solving a real murder amid a crisis in her writing and marriage."
s336,TV Show,Age Gap Love,,Fay Ripley,United Kingdom,12-Jul-19,2017,TV-MA,1 Season,"British TV Shows, Reality TV, Romantic TV Shows","Despite the social backlash and challenges that come with intergenerational romance, these couples choose to stick together through thick and thin."
s337,TV Show,Age of Glory,,"Debbie Goh, Aenie Wong, Frederick Lee, Leslie Chai",,14-Aug-17,2010,TV-MA,2 Seasons,"International TV Shows, Romantic TV Shows, TV Dramas","Amid the thriving nightlife of 1960s Kuala Lumpur, three Chinese friends – a showgirl, her housekeeper and a chanteuse – find love and heartbreak."
s338,TV Show,Age of Rebellion,Peter Ho,"Peter Ho, Jeanine Yang, Tammy Chen, Jason Tsou, Chang Ting-hu, Nana Lee, Nien Hsuan Wu",Taiwan,1-Sep-18,2018,TV-MA,1 Season,"Crime TV Shows, International TV Shows, TV Dramas","At their high school, a group of unruly teens wreak havoc, face bullies and navigate turbulent lives beyond school grounds."
