show_id,type,title,director,cast,country,date_added,release_year,rating,duration,listed_in,description
s1,TV Show,3%,,"João Miguel, Bianca Comparato, Michel Gomes, Rodolfo Valente, Vaneza Oliveira, Rafael Lozano, Viviane Porto, Mel Fronckowiak, Sergio Mamberti, Zezé Motta, Celso Frateschi",Brazil,14-Aug-20,2020,TV-MA,4 Seasons,"International TV Shows, TV Dramas, TV Sci-Fi & Fantasy","In a future where the elite inhabit an island paradise far from the crowded slums, you get one chance to join the 3% saved from squalor."
s2,Movie,7:19,Jorge Michel Grau,"Demián Bichir, Héctor Bonilla, Oscar Serrano, Azalia Ortiz, Octavio Michel, Carmen Beato",Mexico,23-Dec-16,2016,TV-MA,93 min,"Dramas, International Movies","After a devastating earthquake hits Mexico City, trapped survivors from all walks of life wait to be rescued while trying desperately to stay alive."
s3,Movie,23:59,Gilbert Chan,"Tedd Chan, Stella Chung, Henley Hii, Lawrence Koh, Tommy Kuan, Josh Lai, Mark Lee, Susan Leong, Benjamin Lim",Singapore,20-Dec-18,2011,R,78 min,"Horror Movies, International Movies","When an army recruit is found dead, his fellow soldiers are forced to confront a terrifying secret that's haunting their jungle island training camp."
s4,Movie,9,Shane Acker,"Elijah Wood, John C. Reilly, Jennifer Connelly, Christopher Plummer, Crispin Glover, Martin Landau, Fred Tatasciore, Alan Oppenheimer, Tom Kane",United States,16-Nov-17,2009,PG-13,80 min,"Action & Adventure, Independent Movies, Sci-Fi & Fantasy","In a postapocalyptic world, rag-doll robots hide in fear from dangerous machines out to exterminate them, until a brave newcomer joins the group."
s5,Movie,21,Robert Luketic,"Jim Sturgess, Kevin Spacey, Kate Bosworth, Aaron Yoo, Liza Lapira, Jacob Pitts, Laurence Fishburne, Jack McGee, Josh Gad, Sam Golzari, Helen Carey, Jack Gilpin",United States,1-Jan-20,2008,PG-13,123 min,Dramas,A brilliant group of students become card-counting experts with the intent of swindling millions out of Las Vegas casinos by playing blackjack.
s6,TV Show,46,Serdar Akar,"Erdal Beşikçioğlu, Yasemin Allen, Melis Birkan, Saygın Soysal, Berkan Şal, Metin Belgin, Ayça Eren, Selin Uludoğan, Özay Fecht, Suna Yıldızoğlu",Turkey,1-Jul-17,2016,TV-MA,1 Season,"International TV Shows, TV Dramas, TV Mysteries","A genetics professor experiments with a treatment for his comatose sister that blends medical and shamanic cures, but unlocks a shocking side effect."
s7,Movie,122,Yasir Al Yasiri,"Amina Khalil, Ahmed Dawood, Tarek Lotfy, Ahmed El Fishawy, Mahmoud Hijazi, Jihane Khalil, Asmaa Galal, Tara Emad",Egypt,1-Jun-20,2019,TV-MA,95 min,"Horror Movies, International Movies","After an awful accident, a couple admitted to a grisly hospital are separated and must find each other to escape — before death finds them."
s8,Movie,187,Kevin Reynolds,"Samuel L. Jackson, John Heard, Kelly Rowan, Clifton Collins Jr., Tony Plana",United States,1-Nov-19,1997,R,119 min,Dramas,"After one of his high school students attacks him, dedicated teacher Trevor Garfield grows weary of the gang warfare in the New York City school system and moves to California to teach there, thinking it must be a less hostile environment."
s9,Movie,706,Shravan Kumar,"Divya Dutta, Atul Kulkarni, Mohan Agashe, Anupam Shyam, Raayo S. Bakhirta, Yashvit Sancheti, Greeva Kansara, Archan Trivedi, Rajiv Pathak",India,1-Apr-19,2019,TV-14,118 min,"Horror Movies, International Movies","When a doctor goes missing, his psychiatrist wife treats the bizarre medical condition of a psychic patient, who knows much more than he's leading on."
s10,Movie,1920,Vikram Bhatt,"Rajneesh Duggal, Adah Sharma, Indraneil Sengupta, Anjori Alagh, Rajendranath Zutshi, Vipin Sharma, Amin Hajee, Shri Vallabh Vyas",India,15-Dec-17,2008,TV-MA,143 min,"Horror Movies, International Movies, Thrillers",An architect and his wife move into a castle that is slated to become a luxury hotel. But something inside is determined to stop the renovation.
s11,Movie,1922,Zak Hilditch,"Thomas Jane, Molly Parker, Dylan Schmid, Kaitlyn Bernard, Bob Frazer, Brian d'Arcy James, Neal McDonough",United States,20-Oct-17,2017,TV-MA,103 min,"Dramas, Thrillers","A farmer pens a confession admitting to his wife's murder, but her death is just the beginning of a macabre tale. Based on Stephen King's novella."
s12,TV Show,1983,,"Robert Więckiewicz, Maciej Musiał, Michalina Olszańska, Andrzej Chyra, Clive Russell, Zofia Wichłacz, Edyta Olszówka, Mateusz Kościukiewicz, Ewa Błaszczyk, Vu Le Hong, Tomasz Włosok, Krzysztof Wach","Poland, United States",30-Nov-18,2018,TV-MA,1 Season,"Crime TV Shows, International TV Shows, TV Dramas","In this dark alt-history thriller, a naïve law student and a world-weary detective uncover a conspiracy that has tyrannized Poland for decades."
s13,TV Show,1994,Diego Enrique Osorno,,Mexico,17-May-19,2019,TV-MA,1 Season,"Crime TV Shows, Docuseries, International TV Shows","Archival video and new interviews examine Mexican politics in 1994, a year marked by the rise of the EZLN and the assassination of Luis Donaldo Colosio."
s14,Movie,"2,215",Nottapon Boonprakob,Artiwara Kongmalai,Thailand,1-Mar-19,2018,TV-MA,89 min,"Documentaries, International Movies, Sports Movies","This intimate documentary follows rock star Artiwara Kongmalai on his historic, 2,215-kilometer charity run across Thailand in 2017."
s15,Movie,3022,John Suits,"Omar Epps, Kate Walsh, Miranda Cosgrove, Angus Macfadyen, Jorja Fox, Enver Gjokaj, Haaz Sleiman",United States,19-Mar-20,2019,R,91 min,"Independent Movies, Sci-Fi & Fantasy, Thrillers","Stranded when the Earth is suddenly destroyed in a mysterious cataclysm, the astronauts aboard a marooned space station slowly lose their minds."
s16,Movie,1-Oct,Kunle Afolayan,"Sadiq Daba, David Bailie, Kayode Olaiya, Kehinde Bankole, Fabian Adeoye Lojede, Nick Rhys, Kunle Afolayan, Colin David Reese, Ibrahim Shatta, Femi Adebayo, Kanayo O. Kanayo, Lawrence Stubbings, Ademola Adedoyin",Nigeria,1-Sep-19,2014,TV-14,149 min,"Dramas, International Movies, Thrillers","Against the backdrop of Nigeria's looming independence from Britain, detective Danladi Waziri races to capture a killer terrorizing local women."
s17,TV Show,9-Feb,,"Shahd El Yaseen, Shaila Sabt, Hala, Hanadi Al-Kandari, Salma Salem, Ibrahim Al-Harbi, Mahmoud Boushahri, Yousef Al Balushi, Ghorour, Abdullah Al-bloshi",,20-Mar-19,2018,TV-14,1 Season,"International TV Shows, TV Dramas","As a psychology professor faces Alzheimer's, his daughter and her three close female friends experience romance, marriage, heartbreak and tragedy."
s18,Movie,22-Jul,Paul Greengrass,"Anders Danielsen Lie, Jon Øigarden, Jonas Strand Gravli, Ola G. Furuseth, Maria Bock, Thorbjørn Harr, Jaden Smith","Norway, Iceland, United States",10-Oct-18,2018,R,144 min,"Dramas, Thrillers","After devastating terror attacks in Norway, a young survivor, grieving families and the country rally for justice and healing. Based on a true story."
s19,Movie,15-Aug,Swapnaneel Jayakar,"Rahul Pethe, Mrunmayee Deshpande, Adinath Kothare, Vaibhav Mangale, Jaywant Wadkar, Satish Pulekar, Naina Apte, Uday Tikekar",India,29-Mar-19,2019,TV-14,124 min,"Comedies, Dramas, Independent Movies","On India's Independence Day, a zany mishap in a Mumbai chawl disrupts a young love story while compelling the residents to unite in aid of a little boy."
s20,Movie,'89,,"Lee Dixon, Ian Wright, Paul Merson",United Kingdom,16-May-18,2017,TV-PG,87 min,Sports Movies,"Mixing old footage with interviews, this is the story of Arsenal's improbable win versus Liverpool in the final moments of the 1989 championship game."
s21,Movie,​​Kuch Bheege Alfaaz,Onir,"Geetanjali Thapa, Zain Khan Durrani, Shray Rai Tiwari, Mona Ambegaonkar, Chandreyee Ghosh, Barun Chanda, Saheb Bhattacharjee, Shefali Chauhan",India,1-Sep-18,2018,TV-14,110 min,"Dramas, Independent Movies, International Movies","After accidentally connecting over the Internet, two strangers form a tight friendship – not knowing they already share a bond."
s22,Movie,​Goli Soda 2,Vijay Milton,"Samuthirakani, Bharath Seeni, Vinoth, Esakki Barath, Chemban Vinod Jose, Gautham Menon, Krisha Kurup, Subiksha",India,15-Sep-18,2018,TV-14,128 min,"Action & Adventure, Dramas, International Movies","A taxi driver, a gangster and an athlete struggle to better their lives despite obstacles like crooked politicians, evil dons and caste barriers."
s23,Movie,​Maj Rati ​​Keteki,Santwana Bardoloi,"Adil Hussain, Shakil Imtiaz, Mahendra Rabha, Sulakshana Baruah, Rahul Gautam Sarma, Kulada Bhattacharjya, Indu Mohan Das, Moumita Talukdar",India,15-Sep-18,2017,TV-14,117 min,"Dramas, International Movies","A successful writer returns to the town that launched his career, encountering people who spark nostalgic, often painfully illuminating flashbacks."
s24,Movie,​Mayurakshi,Atanu Ghosh,"Soumitra Chatterjee, Prasenjit Chatterjee, Indrani Haldar, Sudipta Chakraborty, Suman Banerjee, Gargi Roychowdhury",India,15-Sep-18,2017,TV-14,100 min,"Dramas, International Movies","When a middle-aged divorcee returns to Kolkata to visit his ailing father, long-buried memories resurface, bringing new discoveries with them."
s25,TV Show,​SAINT SEIYA: Knights of the Zodiac,,"Bryson Baugus, Emily Neves, Blake Shepard, Patrick Poole, Luci Christian, Adam Gibbs, Masakazu Morita, Fumiko Orikasa, Takahiro Sakurai, Hiroaki Miura, Satomi Sato, Katsuyuki Konishi",Japan,23-Jan-20,2020,TV-14,2 Seasons,"Anime Series, International TV Shows","Seiya and the Knights of the Zodiac rise again to protect the reincarnation of the goddess Athena, but a dark prophecy hangs over them all."
s26,Movie,(T)ERROR,"Lyric R. Cabral, David Felix Sutcliffe",,United States,30-Jun-16,2015,NR,84 min,Documentaries,This real-life look at FBI counterterrorism operations features access to both sides of a sting: the government informant and the radicalized target.
s27,TV Show,(Un)Well,,,United States,12-Aug-20,2020,TV-MA,1 Season,Reality TV,"This docuseries takes a deep dive into the lucrative wellness industry, which touts health and healing. But do the products live up to the promises?"
s28,Movie,#Alive,Cho Il,"Yoo Ah-in, Park Shin-hye",South Korea,8-Sep-20,2020,TV-MA,99 min,"Horror Movies, International Movies, Thrillers","As a grisly virus rampages a city, a lone man stays locked inside his apartment, digitally cut off from seeking help and desperate to find a way out."
s29,Movie,#AnneFrank - Parallel Stories,"Sabina Fedeli, Anna Migotto","Helen Mirren, Gengher Gatti",Italy,1-Jul-20,2019,TV-14,95 min,"Documentaries, International Movies","Through her diary, Anne Frank's story is retold alongside those of five Holocaust survivors in this poignant documentary from Oscar winner Helen Mirren."
s30,TV Show,#blackAF,,"Kenya Barris, Rashida Jones, Iman Benson, Genneya Walton, Scarlet Spencer, Justin Claiborne, Ravi Cabot-Conyers",United States,17-Apr-20,2020,TV-MA,1 Season,TV Comedies,"Kenya Barris and his family navigate relationships, race and culture while grappling with their newfound success in this comedy series."
s31,Movie,#cats_the_mewvie,Michael Margolis,,Canada,5-Feb-20,2020,TV-14,90 min,"Documentaries, International Movies","This pawesome documentary explores how our feline friends became online icons, from the earliest text memes to the rise of celebrity cat influencers."
s32,Movie,#FriendButMarried,Rako Prijanto,"Adipati Dolken, Vanesha Prescilla, Rendi Jhon, Beby Tsabina, Denira Wiraguna, Refal Hady, Diandra Agatha, Sari Nila",Indonesia,21-May-20,2018,TV-G,102 min,"Dramas, International Movies, Romantic Movies","Pining for his high school crush for years, a young man puts up his best efforts to move out of the friend zone until she reveals she's getting married."
s33,Movie,#FriendButMarried 2,Rako Prijanto,"Adipati Dolken, Mawar de Jongh, Sari Nila, Vonny Cornellya, Clay Gribble, Ivan Leonardy, Sarah Sechan, Jourdy Pranata",Indonesia,28-Jun-20,2020,TV-G,104 min,"Dramas, International Movies, Romantic Movies","As Ayu and Ditto finally transition from best friends to newlyweds, a quick pregnancy creates uncertainty for the future of their young marriage."
s34,Movie,#realityhigh,Fernando Lebrija,"Nesta Cooper, Kate Walsh, John Michael Higgins, Keith Powers, Alicia Sanz, Jake Borelli, Kid Ink, Yousef Erakat, Rebekah Graf, Anne Winters, Peter Gilroy, Patrick Davis",United States,8-Sep-17,2017,TV-14,99 min,Comedies,"When nerdy high schooler Dani finally attracts the interest of her longtime crush, she lands in the cross hairs of his ex, a social media celebrity."
s35,Movie,#Roxy,Michael Kennedy,"Jake Short, Sarah Fisher, Booboo Stewart, Danny Trejo, Pippa Mackie, Jake Smith, Patricia Zentilli, Carter Thicke",Canada,10-Apr-19,2018,TV-14,105 min,"Comedies, Romantic Movies",A teenage hacker with a huge nose helps a cool kid woo a girl that he’s secretly in love with.
s36,Movie,#Rucker50,Robert McCullough Jr.,,United States,1-Dec-16,2016,TV-PG,56 min,"Documentaries, Sports Movies",This documentary celebrates the 50th anniversary of the Harlem sports program that has inspired countless city kids to become pro basketball players.
s37,Movie,#Selfie,Cristina Jacob,"Flavia Hojda, Crina Semciuc, Olimpia Melinte, Levent Sali, Vlad Logigan, Alex Calin, Alina Chivulescu, Razvan Vasilescu",Romania,1-Jun-19,2014,TV-MA,125 min,"Comedies, Dramas, International Movies","Two days before their final exams, three teen girls make a seaside getaway to end their adolescence with a bang."
s38,Movie,#Selfie 69,Cristina Jacob,"Maia Morgenstern, Olimpia Melinte, Crina Semciuc, Flavia Hojda, Maria Dinulescu, Alex Calin, Vlad Logigan, Levent Sali, Silvia Busuioc, Mihaela Mihut",Romania,1-Jun-19,2016,TV-MA,119 min,"Comedies, Dramas, International Movies","After a painful breakup, a trio of party-loving friends makes a bet: who can get married in three days."
s39,TV Show,แผนร้ายนายเจ้าเล่ห์,,"Chutavuth Pattarakampol, Sheranut Yusananda, Nichaphat Chatchaipholrat, Thassapak Hsu",,30-Mar-19,2016,TV-14,1 Season,"International TV Shows, Romantic TV Shows, TV Comedies","When two brothers fall for two sisters, they quickly realize the age differences between them are too big to ignore."
s40,Movie,"¡Ay, mi madre!",Frank Ariza,"Estefanía de los Santos, Secun de la Rosa, Terele Pávez, María Alfonsa Rosso, Mariola Fuentes, Alfonso Sánchez, Paz Vega, Marta Torné, Concha Galán",Spain,19-Jul-19,2019,TV-MA,81 min,"Comedies, International Movies","When her estranged mother suddenly dies, a woman must follow the quirky instructions laid out in the will in order to collect an important inheritance."
s41,Movie,Çarsi Pazar,Muharrem Gülmez,"Erdem Yener, Ayhan Taş, Emin Olcay, Muharrem Gülmez, Elif Nur Kerkük, Tarık Papuççuoğlu, Suzan Aksoy, Doğa Konakoğlu, Esin Eden, Deniz Özerman",Turkey,10-Mar-17,2015,TV-14,97 min,"Comedies, International Movies",The slacker owner of a public bath house rallies his community to save it when a big developer comes to town to close it down and open a new mall.
s42,Movie,Ég man þig,Óskar Thór Axelsson,"Jóhannes Haukur Jóhannesson, Ágústa Eva Erlendsdóttir, Elma Stefania Agustsdottir, Thor Kristjansson, Anna Gunndís Guðmundsdóttir, Sara Dögg Ásgeirsdóttir, Þröstur Leó Gunnarsson, Jóhann Sigurðarson, Sveinn Geirsson, Arnar Páll Harðarson",Iceland,27-Mar-18,2017,TV-MA,106 min,"Horror Movies, International Movies","Young urbanites renovating a rundown house, and a psychiatrist grieving his son's disappearance, are connected to a supernatural, decades-old secret."
s43,Movie,Çok Filim Hareketler Bunlar,Ozan Açıktan,"Ayça Erturan, Aydan Taş, Ayşegül Akdemir, Burcu Gönder, Bülent Emrah Parlak, Büşra Pekin, Emre Canpolat, Ersin Korkut, Eser Yenenler, Gizem Tuğral, Gülhan Tekin, Gülsüm Alkan, Hamdi Kahraman, İbrahim Büyükak, Metin Keçeci",Turkey,10-Mar-17,2010,TV-MA,99 min,"Comedies, International Movies","Vignettes of the summer holidays follow vacationers as they battle mosquitoes, suffer ruined plans and otherwise hit snags in their precious time off."
s44,Movie,Òlòtūré,Kenneth Gyang,"Beverly Osu, Sharon Ooja, Omowunmi Dada, Pearl Okorie, Wofai Samuel, Ikechukwu Onunaku, Kemi Lala Akindoju, Blossom Chukwujekwu, Adebukola Oladipupo, Omoni Oboli, Segun Arinze, Ada Ameh, Sambasa Nzeribe, Patrick Doyle, Gregory Ojefua",Nigeria,2-Oct-20,2020,TV-MA,107 min,"Dramas, International Movies","In Lagos, a journalist goes undercover as a prostitute to expose human trafficking. What she finds is a world of exploited women and ruthless violence."
s45,Movie,Æon Flux,Karyn Kusama,"Charlize Theron, Marton Csokas, Jonny Lee Miller, Sophie Okonedo, Frances McDormand, Pete Postlethwaite, Amelia Warner, Caroline Chikezie, Nikolai Kinski, Paterson Joseph, Yangzom Brauen",United States,1-Feb-18,2005,PG-13,93 min,"Action & Adventure, Sci-Fi & Fantasy","Aiming to hasten an uprising, the leader of an underground rebellion dispatches acrobatic assassin Aeon Flux to eliminate the government's top leader."
s46,TV Show,Şubat,,"Alican Yücesoy, Melisa Sözen, Musa Uzunlar, Serkan Ercan, Özkan Uğur, Ülkü Duru, Tansu Biçer, Nadir Sarıbacak, Sermet Yeşil, Ayhan Kavas",Turkey,17-Jan-17,2013,TV-MA,1 Season,"Crime TV Shows, International TV Shows, TV Dramas","An orphan subjected to tests that gave him superpowers is rescued and raised on Istanbul's streets, where he falls for a reporter linked to his past."
s47,Movie,1 Chance 2 Dance,Adam Deyoe,"Lexi Giovagnoli, Justin Ray, Rae Latt, Poonam Basu, Teresa Biter, Kalilah Harris, Alexia Dox, Adam Powell, Sean McBride",United States,1-Jul-17,2014,TV-PG,89 min,"Dramas, Romantic Movies","When an aspiring dancer is uprooted during her senior year of high school, she finds herself torn between two boys – and with one shot at her dream."
s48,Movie,1 Mile to You,Leif Tilden,"Billy Crudup, Graham Rogers, Liana Liberato, Stefanie Scott, Tim Roth, Melanie Lynskey, Thomas Cocquerel, Peter Coyote",United States,7-Jul-17,2017,TV-14,105 min,"Dramas, Romantic Movies, Sports Movies","After escaping the bus accident that killed his girlfriend, a high school student channels his grief into running, with the help of a new coach."
s49,Movie,10 Days in Sun City,Adze Ugah,"Ayo Makun, Adesua Etomi, Richard Mofe-Damijo, Mercy Johnson, Falz, Tuface Idibia, Thenjiwe Moseley, Motlatsi Mafatshe, Celeste Ntuli, Miguel A. Núñez Jr.","South Africa, Nigeria",18-Oct-19,2017,TV-14,87 min,"Comedies, International Movies, Romantic Movies","After his girlfriend wins the Miss Nigeria pageant, a young man faces unexpected competition of his own when he joins her on a campaign in South Africa."
s50,Movie,10 jours en or,Nicolas Brossette,"Franck Dubosc, Claude Rich, Marie Kremer, Mathis Touré, Rufus, Olivier Claverie",France,1-Jul-17,2012,TV-14,97 min,"Comedies, Dramas, International Movies","When a carefree bachelor is unexpectedly left in charge of a young boy, the two embark on a road trip that will change both of their lives."
s51,Movie,"10,000 B.C.",Roland Emmerich,"Steven Strait, Camilla Belle, Cliff Curtis, Joel Virgel, Affif Ben Badra, Mo Zinal, Nathanael Baring, Mona Hammond, Omar Sharif","United States, South Africa",1-Jun-19,2008,PG-13,109 min,Action & Adventure,Fierce mammoth hunter D'Leh sets out on an impossible journey to rescue the woman he loves from a vicious warlord and save the people of his village.
s52,TV Show,100 Days My Prince,,"Doh Kyung-soo, Nam Ji-hyun, Cho Seong-ha, Cho Han-cheul, Kim Seon-ho, Han So-hee",South Korea,7-Dec-20,2018,TV-14,1 Season,"International TV Shows, Romantic TV Shows, TV Dramas","Upon losing his memory, a crown prince encounters a commoner’s life and experiences unforgettable love as the husband to Joseon’s oldest bachelorette."
s53,Movie,100 Days Of Solitude,,,Spain,6-Jul-18,2018,TV-MA,93 min,"Documentaries, International Movies","Spanish photographer José Díaz spends 100 days living alone on a remote mountain, connecting to nature and documenting the beauty of his surroundings."
s54,TV Show,100 Humans,,"Zainab Johnson, Sammy Obeid, Alie Ward",United States,13-Mar-20,2020,TV-14,1 Season,"Docuseries, Science & Nature TV","One hundred hardy souls from diverse backgrounds participate in playful experiments exploring age, sex, happiness and other aspects of being human."
s55,Movie,100 Meters,Marcel Barrena,"Dani Rovira, Karra Elejalde, Alexandra Jiménez, David Verdaguer, Clara Segura, Alba Ribas, Bruno Bergonzini, Ricardo Pereira, Manuela Couto, Marc Balaguer","Portugal, Spain",10-Mar-17,2016,TV-MA,109 min,"Dramas, International Movies, Sports Movies","A man who is diagnosed with multiple sclerosis responds by training for an Ironman triathlon, with his cranky father-in-law's help."
s56,Movie,100 Things to do Before High School,,"Isabela Moner, Jaheem Toombs, Owen Joyner, Jack De Sena, Brady Reiter, Lisa Arch, Stephanie Escajeda",United States,2-Nov-19,2014,TV-Y,44 min,Movies,"Led by seventh-grader C.J., three students who have been warned about the dangers of high school decide to make the best of their middle-school years."
s57,Movie,100 Years: One Woman's Fight for Justice,Melinda Janko,,United States,20-Mar-18,2016,TV-14,75 min,Documentaries,This documentary chronicles Elouise Cobell's long fight against the U.S. government for the gross mismanagement of mineral-rich Native American land.
s58,Movie,100% Halal,Jastis Arimba,"Anisa Rahma, Ariyo Wahab, Anandito Dwis, Fitria Rasyidi, Arafah Rianti, Kinaryosih",Indonesia,7-Jan-21,2020,TV-14,101 min,"Dramas, International Movies","After high school, a young woman marries the man of her father's choice but soon faces the possibility that her religion considers the union invalid."
s59,TV Show,100% Hotter,,"Daniel Palmer, Melissa Sophia, Karen Williams, Grace Woodward",United Kingdom,1-Nov-19,2017,TV-14,1 Season,"British TV Shows, International TV Shows, Reality TV","A stylist, a hair designer and a makeup artist team up to give Britain's biggest fashion disasters some much-needed makeunders."
s60,Movie,1000 Rupee Note,Shrihari Sathe,"Usha Naik, Sandeep Pathak, Shrikant Yadav, Ganesh Yadav, Pooja Nayak, Devendra Gaikwad",India,1-Dec-16,2014,TV-14,89 min,"Dramas, International Movies","After randomly receiving a handsome political bribe, a sweet, poor elderly woman decides to treat herself a shopping spree, which doesn't go smoothly."
s61,Movie,12 ROUND GUN,Sam Upton,"Sam Upton, Jared Abrahamson, Mark Boone Junior, Laila Ali, Kate Vernon, Cassi Thomson, Colby French, Miguel Perez, Jay Acovone",United States,14-Mar-19,2017,TV-MA,90 min,"Dramas, Independent Movies, Sports Movies","Dealing with personal demons and the death of his son, a prizefighter attempts a return to the ring by challenging his rival to a 12-round rematch."
s62,TV Show,12 Years Promise,,"So-yeon Lee, Namkoong Min, Tae-im Lee, So-hui Yoon, Won-keun Lee, Hyo-young Ryu",South Korea,22-May-17,2014,TV-14,1 Season,"International TV Shows, Korean TV Shows, Romantic TV Shows","A pregnant teen is forced by her family to leave her boyfriend and assume a new identity in America, but 12 years later, the couple reunites in Korea."
s63,Movie,13 Cameras,Victor Zarcoff,"PJ McCabe, Brianne Moncrief, Sarah Baldwin, Jim Cummings, Heidi Niedermeyer, Neville Archambault",United States,13-Aug-16,2015,NR,90 min,"Horror Movies, Independent Movies, Thrillers","Young parents-to-be Claire and Ryan move into a suburban rental home, unaware that someone is secretly watching their every move via hidden cameras."
s64,TV Show,13 Reasons Why,,"Dylan Minnette, Katherine Langford, Kate Walsh, Derek Luke, Brian d'Arcy James, Alisha Boe, Christian Navarro, Miles Heizer, Ross Butler, Devin Druid, Michele Selene Ang, Steven Silver, Amy Hargreaves",United States,5-Jun-20,2020,TV-MA,4 Seasons,"Crime TV Shows, TV Dramas, TV Mysteries","After a teenage girl's perplexing suicide, a classmate receives a series of tapes that unravel the mystery of her tragic choice."
s65,TV Show,13 Reasons Why: Beyond the Reasons,,"Dylan Minnette, Katherine Langford, Kate Walsh, Derek Luke, Alisha Boe, Justin Prentice, Brandon Flynn, Miles Heizer, Christian Navarro, Brian Yorkey, Tom McCarthy, Selena Gomez, Mandy Teefey, Jay Asher, Dr. Rona Hu, Dr. Helen Hsu, Dr. Rebecca Hedrick, Alexis Jones, Elaine Welteroth, Julia Bicknell, Dr. Christine Moutier, Nic Sheff, Carrie Goldberg, Anne Winters, Joy Gorman, Brandon Butler, Marissa Jo Cerar, Susanne Timms",United States,23-Aug-19,2019,TV-MA,3 Seasons,"Crime TV Shows, Docuseries","Cast members, writers, producers and mental health professionals discuss some of the difficult issues and themes explored in ""13 Reasons Why."""
s66,Movie,13 Sins,Daniel Stamm,"Mark Webber, Rutina Wesley, Devon Graye, Tom Bower, Ron Perlman, Pruitt Taylor Vince",United States,13-Jan-19,2014,R,93 min,"Horror Movies, Thrillers","A man agrees to appear on a game show with a $6 million prize. But as the challenges become more extreme, he realizes he's made a grave mistake."
s67,Movie,13TH,Ava DuVernay,,United States,7-Oct-16,2016,TV-MA,101 min,Documentaries,"In this thought-provoking documentary, scholars, activists and politicians analyze the criminalization of African Americans and the U.S. prison boom."
s68,Movie,13TH: A Conversation with Oprah Winfrey & Ava DuVernay,,"Oprah Winfrey, Ava DuVernay",,26-Jan-17,2017,,37 min,Movies,"Oprah Winfrey sits down with director Ava DuVernay to discuss her Oscar-nominated film, historical cycles of oppression and the broken prison system."
